"https://amazon.com/dp/B08353CNYB","B08353CNYB","Beauty Salon Breast Pillow Feminine Bolster Breast Pillow for Massage Table, Massage Face Cradle Rest Pillow for SPA Salon,D","SHKY","FBM","Health & Household",941671,"Tools & Accessories",25.8,"N/A",0,0,0,"N/A","N/A","CunShangMaoBu",1,"N/A","N/A","N/A","N/A","N/A","N/A","N/A","N/A","N/A","03/01/2021",25,7,4,"N/A"
"https://amazon.com/dp/B085QFXZ8X","B085QFXZ8X","BEUU Men Women 8mm Lava Rock 7 Chakra Aromatherapy Essential Oil Diffuser Bracelet Elastic Natural Stone Yoga Beads Bracelet Bangle","BEUU","FBM","Health & Household",1040043,"Diffusers",7.99,"N/A",0,0,0,1,1,"BEUU(Deliver in 7-14 Days)",1,"N/A","N/A","N/A","N/A","N/A","N/A","N/A","N/A","N/A","03/01/2021",32,2,4,0
"https://amazon.com/dp/B091717FRX","B091717FRX","Munchables Chewable Pencil Toppers for Kids and Adults - Set of 4 Chew Blockz (Purple, Blue, Green, Dark Purple)","Munchables: Jewelry For Kids that Chew","FBA","Health & Household",80978,"Sensory Motor Aids",14.99,-3,186,9,2788.14,632,4.4,"Munchables Sensory Solutions Ltd.",1,185,"N/A","Small Standard-Size",4.1338582677165,4.5669291338583,0.59055118110236,0.143325,4.451872830910991,15.484775064038232,"03/01/2023",24,5,11,0.29
"https://amazon.com/dp/B08LYRKSW7","B08LYRKSW7","Comfortable Orthotic Flip Flops for Women, Plantar Fasciitis Recovery Sandals for Flat Feet, Arch Support Thong Sandals with Memory Foam size 8.5","Orkii","FBA","Health & Household",41328,"Arch Supports",29.99,-8,463,40,13885.37,1984,4.4,"Orkii",1,9401,"N/A","Large Standard-Size",4.45,11.38,3.66,1.00989,74.00971145833333,257.42508333333336,"06/01/2021",26,7,76,0.23
"https://amazon.com/dp/B08CDZK6HC","B08CDZK6HC","Inhaleix A120 Alcohol Extract Tincture, Elecampane Root, Horehound Herb, Marshmallow Root, Pleurisy Root, Ginger Root, Licorice Root, Cordyceps Mushroom. Healthy Lungs Formula 4 Fl Oz","HerbEra","FBM","Health & Household",1081641,"Herbal Supplements",33.99,"N/A",0,0,0,"N/A","N/A","HerbEra",1,"N/A","N/A","N/A","N/A","N/A","N/A","N/A","N/A","N/A","-",29,5,2,"N/A"
"https://amazon.com/dp/B08PQFK3S3","B08PQFK3S3","XBERSTAR Durable Scrub Scouring Sponge,Multifunctional Double-Sided Dishwashing Sponges with Adhesive Hooks/Dishwashing Gloves for Household Kitchen Cleaning","XBERSTAR","FBM","Health & Household",1031502,"Sponges",5.89,"N/A",0,0,0,"N/A","N/A","BoomDealer",1,"N/A","N/A","Small Standard-Size",3.740157480315,0.51181102362205,6.496062992126,0.441,"N/A","N/A","04/01/2021",25,7,0,"N/A"
"https://amazon.com/dp/B094YV6V2V","B094YV6V2V","Reduce Straw & Bottle Brush Set - 2-in-1 Large and Small Set, Ideal for Straws Plus Water & Sports Bottles, Tumblers - Hygienic Silicone, Non Scratch - Small Brush Stores Inside Large Brush","REDUCE","FBA","Health & Household",387277,"Brushes",14.95,-12,6,67,89.7,32,4,"Firefly Buys",1,79,"N/A","Large Standard-Size",3.86,15.16,1.22,0.310905,28.50701138888889,99.15482222222224,"10/01/2021",23,1,0,0.19
"https://amazon.com/dp/B097BV7KVJ","B097BV7KVJ","Tattoo Arm Leg Armrest, Adjustable Height and Tilt Iron Tattoo Arm Rest Tripod Stand with PU Leather Pad Chair Stand Tattoo Workstation for Studio Salon (28.6-47.4 inch)","Qiilu","FBM","Health & Household",283307,"Tattoo Machine Parts",26.54,10,0,-100,0,5,4.8,"Lusesse",1,22,"N/A","Small Oversize",7.5,25.3,4.5,4.40118,"N/A","N/A","08/01/2021",22,8,2,0