"https://amazon.com/dp/B09M1LPSHD","B09M1LPSHD","Grupo Star Wars Mandalorian Jersey Christmas Stocking, The Child Grogu, Baby Yoda, 15 inches, Green","Grupo","FBA","Baby Products",135523,"Activity & Entertainment",14.99,-7,0,-133,0,4,5,"Sueperior Living",3,27,"N/A","Large Standard-Size",7.007874015748,9.6850393700787,1.6141732283465,0.16758,43.74648554087214,152.16168883781614,"11/01/2022",16,1,0,0
"https://amazon.com/dp/B09MLSNDQ5","B09MLSNDQ5","Baby Princess Pu Color Bow Tie Leather Casual Crown Headband Set Children's (Red, 12-18 Months)","MSDMSASD","FBM","Baby Products",227677,"Hair Accessories",8.99,"N/A",0,0,0,"N/A","N/A","MSDMSASD",1,"N/A","N/A","N/A","N/A","N/A","N/A","N/A","N/A","N/A","12/01/2021",16,7,24,"N/A"
"https://amazon.com/dp/B09M4CJC6Q","B09M4CJC6Q","Fun and Safe in the Sun Kit by the Makers of Boogie Wipes, Bundle Includes 2 Pack Boogie Block, and 6 Pack of 20 Count Boogie Hands Alcohol Free Sanitizing Wipes","Boogie Drops","FBA","Baby Products",180481,"Sun Protection",25.57,"N/A",0,-67,0,2,5,"Eleeo Brands",1,5,"N/A","N/A","N/A","N/A","N/A","N/A","N/A","N/A","05/01/2022",16,6,0,0
"https://amazon.com/dp/B09HZXGYZ1","B09HZXGYZ1","DaVinci Maya Upholstered Swivel Glider and Ottoman in Misty Gray, Greenguard Gold Certified","DaVinci","Amazon","Baby Products",66865,"Glider & Ottoman Sets",499,40,5,-74,2495,254,4.5,"Amazon",2,429,"N/A","Special Oversize",31,30,35,92,"N/A","N/A","07/01/2022",16,7,5,0.02
"https://amazon.com/dp/B0B8ST9S24","B0B8ST9S24","Comfort Bag,Folding Storage Bag with Crib,Large Capacity Folding Bag Our Comfort Bag is Super Spacious and Reinforced, It Fits and More Carry Everything","Generic","FBM","Baby Products",183763,"Infant & Toddler Travel Beds",33.99,"N/A",0,-150,0,"N/A","N/A","Ussuma",1,"N/A","N/A","N/A","N/A","N/A","N/A","N/A","N/A","N/A","12/01/2022",8,6,6,"N/A"
"https://amazon.com/dp/B09MRR6YQL","B09MRR6YQL","Mocsicka Twinkle Twinkle Little Star Baby Shower Backdrop Gold Glitter Stars and Moon Pink Baby Shower Party Decorations for Girls Sparkle Stars Gender Reveal Photography Background (10x8ft)","Mocsicka","FBM","Baby Products",16143,"Gift Sets",44.99,"N/A",79,23,3554.21,16,4.5,"Mocsicka Direct",1,820,"N/A","Large Standard-Size",7.8740157480315,1.1811023622047,7.8740157480315,0.7488986784141,"N/A","N/A","01/01/2023",14,6,10,4.94