"URL","ASIN","Title","Brand","Fulfillment","Category","BSR","Subcategory","Price","Price Trend (90 days) (%)","Monthly Sales","Sales Trend (90 days) (%)","Monthly Revenue","Review Count","Reviews Rating","Seller","Number of Active Sellers","Last Year Sales","Sales Year Over Year (%)","Size Tier","Width","Height","Length","Weight","Storage Fee (Jan - Sep)","Storage Fee (Oct - Dec)","Best Sales Period","Age (Month)","Number of Images","Variation Count","Sales to Reviews"
"https://amazon.com/dp/B0B9KPVS19","B0B9KPVS19","Diaper Bag Backpack with Changing Station, Large Baby Bags for Girl Boys Dad Mom, Baby Shower Gifts, Baby Registry Search, Baby Stuff for Newborn Essentials Must Haves Items, Leopard","PLOKUO","FBA","Baby Products",65870,"Backpacks",37.99,"N/A",6,50,227.94,62,4.6,"PLOKUO",1,3913,"N/A","Large Standard-Size",13.23,16.5,3.15,2.890755,274.5741796875,955.0406250000001,"08/01/2022",7,6,5,0.1
"https://amazon.com/dp/B0B3TDH5BX","B0B3TDH5BX","Night Light for Kids，Cattle Lamp Cute Gifts, 7 Colors Kids Night Light for Kids Room,Cattle Room Decor for Boys Cute Night Light, Waterproof Silicone Nursery Battery Baby Night Light","RSSER","FBA","Baby Products",45618,"Night Lights",6.98,"N/A",1,-122,6.98,27,3.9,"RSSER LIGHTING",1,"N/A","N/A","Large Standard-Size",3.19,4.13,3.19,0.18081,16.78173157986111,58.37124027777778,"10/01/2022",8,6,3,0.04
"https://amazon.com/dp/B09Z75GC97","B09Z75GC97","Medela Women's 3 in 1 Nursing & Pumping Bra, Chai, X-Large","Medela","Amazon","Baby Products",1428,"Electric",25.99,-22,9937,50,258262.63,11983,4.3,"Amazon",1,"N/A","N/A","Large Standard-Size",8.0708661417323,8.2283464566929,2.5196850393701,0.3087,"N/A","N/A","02/01/2023",11,6,8,0.83
"https://amazon.com/dp/B0B6GR7BHY","B0B6GR7BHY","Bluey Unisex Baby Potty Training Pants, 100% Cotton Padded Underwear, 7-Pack, Sizes 18 M, 2T, 3T and 4T, Bluey7pktrainingpant","Bluey","Amazon","Baby Products",6084,"Training Pants",18.14,1,849,52317,15884.79,41,4.4,"Amazon",2,"N/A","N/A","Large Standard-Size",7.1259842519685,9.9606299212598,2.0866141732283,0.64386,"N/A","N/A","02/01/2023",8,8,4,84.9
"https://amazon.com/dp/B0B3CW66NL","B0B3CW66NL","Harborway Silicone Baby Bibs for Boys Girls, Reusable Waterproof Adjustable Silicone Bibs for Babies & Toddlers(pinkish purple, yolk yellow, dusty blue)","Harborway","FBA","Baby Products",16743,"Feeding Bibs",6.99,-17,15,0,104.85,3,5,"SKYPIE GIFT",1,"N/A","N/A","Large Standard-Size",6.69,9.33,1.77,0.78939,44.11500984375,153.4435125,"11/01/2022",10,7,2,5
"https://amazon.com/dp/B09Q8TDYHG","B09Q8TDYHG","3 Pieces Pinch Pleated Crib Bedding Set Silk Satin Solid Color White Cute Baby Comforter with Ruffle Fringe Unisex Summer Pintuck Crib Fitted Sheet with Pillowcases for Boys and Girls","UOZZI BEDDING","FBA","Baby Products",66243,"Crib Bedding Sets",29.99,-23,19,26,0,28,4.2,"Uozzi Home",1,462,"N/A","Large Standard-Size",10.708661417323,14.566929133858,2.8346456692913,2.05506,176.5661011636954,614.1429605693754,"04/01/2022",13,9,8,0.68
"https://amazon.com/dp/B093SWBF64","B093SWBF64","Dinosaur Baby Car Seat Cover Swaddle Cocoon with Beanie for Boys and Girls, Multiuse Carseat Canopy & Cocoon Sack for Newborn, Mom Nursing Breastfeeding Covers, Baby Photography","TANOFAR","FBA","Baby Products",250264,"Canopies & Covers",24.99,"N/A",0,0,0,1,5,"TANOFAR",1,"N/A","N/A","N/A","N/A","N/A","N/A","N/A","N/A","N/A","04/01/2022",22,9,0,0
"https://amazon.com/dp/B07WH44XTV","B07WH44XTV","X Men Character Multiple Font Custom Name Nursery Wall Decal Vinyl Sticker | Home Décor | Custom Kids Room Decal | Bedside Decals | Children’s Room| Car | Laptop","Kraftmatics Design","FBM","Baby Products",227657,"Wall Stickers & Murals",16.95,-17,0,0,0,1,5,"kraftmatics",1,"N/A","N/A","Small Oversize",2,2,22,8,"N/A","N/A","02/01/2022",39,9,0,0
"https://amazon.com/dp/B09T9P649R","B09T9P649R","Chippi & Co Premium I Heart Milk Baby 4-Layer Muslin Quilt, Soft Bamboo Cotton Receiving Blanket for Unisex Infant Boys and Girls, 47x47'' (I Heart Milk)","Chippi & Co","FBA","Baby Products",171535,"Quilts",27.99,"N/A",0,0,0,"N/A","N/A","Chippi & Co",1,12,"N/A","Large Standard-Size",12.874015748031,13.031496062992,2.3228346456693,0.919485,155.60801432051647,541.2452672017964,"04/01/2022",13,7,9,"N/A"
"https://amazon.com/dp/B096X335KS","B096X335KS","Hoomall Baby Strollers Baby Trolley Car Seat Stroller ​Foldable Sunshades Cover Sails Babies Carriages Umbrellas for Traveling Summer(navy)","Hoomall","FBM","Baby Products",238812,"Lightweight",12.99,"N/A",0,0,0,1,1,"Moon US",1,"N/A","N/A","N/A","N/A","N/A","N/A","N/A","N/A","N/A","08/01/2022",21,9,4,0
"https://amazon.com/dp/B093WNMV1K","B093WNMV1K","NAMESAKE Noelle 4-in-1 Convertible Metal Crib in Vintage White, Greenguard Gold Certified","NAMESAKE","Amazon","Baby Products",26814,"Convertible Cribs",421.26,-9,1,-20,421.26,11,4.2,"Amazon",1,105,"N/A","Large Oversize",42,6,57,88,"N/A","N/A","11/01/2021",21,9,2,0.09
"https://amazon.com/dp/B09FFFW5LS","B09FFFW5LS","9 Pieces Pacifier Clip for Boys and Girls Braided Pacifier Clip Baby Pacifier Leash Pacifier Holders with Stainless Steel Clip Pacifier Holder Clip Fits for Most Pacifier Unisex Baby Shower Set","Nuanchu","FBA","Baby Products",59944,"Pacifier Accessories",14.99,"N/A",0,-100,0,188,4.5,"Holph",1,1845,"N/A","Small Standard-Size",4.76,7.05,0.71,0.200655,9.513926041666664,33.09191666666666,"08/01/2022",19,7,0,0
"https://amazon.com/dp/B08YWSYJ6L","B08YWSYJ6L","Hearts Pink Watercolor Abstract Vinyl Wall Decals 55 pcs - Rooms and Stickers","ROOMS & STICKERS","FBA","Baby Products",154310,"Wall Stickers & Murals",11.99,"N/A",0,0,0,3,5,"Rooms and Stickers",1,11,"N/A","Small Standard-Size",10.866141732283,14.763779527559,0.47244094488189,0.3528,30.2639630869799,105.26595856340835,"05/01/2022",22,3,0,0
"https://amazon.com/dp/B09BBJMF8Y","B09BBJMF8Y","Newton Baby Organic Fitted Mini Crib Sheet (2-Pack) - 100% Breathable and Ultra-Soft, 100% Organic Muslin Cotton, 24"" x 38"" and up to 8"", Twilight Grey +Solid White","Newton Baby","FBA","Baby Products",79794,"Bed Sheets",39.99,"N/A",0,0,0,18,4.1,"Newton Baby",1,2673,"N/A","Large Standard-Size",9.57,11.18,3.07,0.82026,131.1588105208333,456.2045583333332,"08/01/2022",19,9,0,0
"https://amazon.com/dp/B098HZM8Q4","B098HZM8Q4","Honra Newborn Photography Props Pearl Headband Baby Photoshoots Posing Photo Tieback Hair Accessories (White)","Honra","FBA","Baby Products",36171,"Headbands",9.99,"N/A",17,-22,169.83,14,4.4,"Honra Studio",1,"N/A","N/A","Small Standard-Size",2.9133858267717,3.4645669291339,0.59055118110236,0.05292,2.3801802852950114,8.278887948852214,"09/01/2022",21,5,8,1.21
"https://amazon.com/dp/B08QV15525","B08QV15525","Little Me Plush Rattle Baby Snuggle Blanket with Embroidery and Satin, Blue Bear","Little Me","FBA","Baby Products",86252,"Swaddling Blankets",20.68,2,2,0,41.36,8,4.8,"Optimum Convenience",1,52,"N/A","Large Standard-Size",6.42,10.98,2.64,0.200655,74.309895,258.4692,"08/01/2022",22,1,0,0.25
"https://amazon.com/dp/B09KNV13F2","B09KNV13F2","Lynn and Jade Nursery Decor for Boys, UNFRAMED 8x10in Posters for Boys Room, African American Wall Art, Boys Room Wall Decor, Boy Nursery Decor, Nursery Wall Decor w/ Bonus Door Hanger","Lynn and Jade","FBA","Baby Products",158992,"Wall Stickers & Murals",12.99,"N/A",0,0,0,"N/A","N/A","Lynn and Jade",1,7,"N/A","Small Standard-Size",8.9370078740157,11.338582677165,0.19685039370079,0.28224,7.965124197964744,27.704779819007804,"04/01/2022",17,8,0,"N/A"
"https://amazon.com/dp/B096DFDX2Y","B096DFDX2Y","Stretchy Baby Car Seat Cover for Baby Boys and Girls and Newborn Baby Swaddle Blankets Sets Infant Boy Receiving Blankets","TANOFAR","FBA","Baby Products",253814,"Swaddling Blankets",27.99,"N/A",0,0,0,"N/A","N/A","TANOFAR",1,"N/A","N/A","N/A","N/A","N/A","N/A","N/A","N/A","N/A","-",22,8,0,"N/A"
"https://amazon.com/dp/B098357VNQ","B098357VNQ","coastal rose Over The Door Organizer,5 Pockets Hanging Storage Shelves,Foldable Over Door Storage Nursery Baby Organizer with 2 Metal Hooks for Children's Room,Bedroom,Bathroom,Office,Grey","coastal rose","FBA","Baby Products",26606,"Hanging Shelves",23.99,"N/A",372,213,8924.28,482,4.6,"SIXGO",1,3001,"N/A","Large Standard-Size",11.338582677165,13.307086614173,2.8346456692913,1.83015,170.78349117327096,594.0295345157251,"09/01/2021",20,7,15,0.77
"https://amazon.com/dp/B09JNFMB27","B09JNFMB27","RENAISSANT 3 Pack - Childproof Door Lever Lock, Prevents Toddlers from Opening Doors, Easy One Hand Operation Door Locks for Kids Safety, ABS with Damage-Free 3M Adhesive Child Safety Door Handle Lock","RENAISSANT","FBA","Baby Products",9946,"Guards & Locks",16.99,"N/A",338,12,0,420,4.4,"cdorigin",1,1477,"N/A","Large Standard-Size",5.3543307086614,5.3937007874016,1.2204724409449,0.394695,14.074253596888873,48.953925554396086,"02/01/2023",17,6,6,0.82
"https://amazon.com/dp/B09DYJ3RDM","B09DYJ3RDM","SAHMYOOK Storage Baskets for Organizing Children Nursery Hamper Fabric Storage Bins with Handles Large Storage Bags Storage Boxes Containers Organizer Storage Cubes for Nursery Office Closet Shelf","SAHMYOOK","FBA","Baby Products",190771,"Storage Bins & Boxes",22.99,"N/A",0,0,0,2,5,"San Yu",1,2,"N/A","Small Oversize",15.5,17.5,2,1.45089,150.69444444444443,376.7361111111111,"10/01/2021",19,7,4,0
"https://amazon.com/dp/B00155YNWA","B00155YNWA","Gerber Gentle Medium Flow Silicone Nipples","Gerber","FBA","Baby Products",156555,"Nipples",9.99,68,1,0,9.99,5,3.4,"MBO North",1,4,-33,"Small Standard-Size",2.8,0.2,5.1,0.06,1.1404166666666664,3.966666666666666,"01/01/2022",144,2,0,0.2
"https://amazon.com/dp/B073RYYV5C","B073RYYV5C","Bugaboo Donkey2 Base Fabrics, Blue Melange","Bugaboo","FBM","Baby Products",208072,"Bassinets & Carrycots",244.84,"N/A",0,0,0,0,"N/A","Babesta",2,"N/A","N/A","Small Oversize",22.992125984252,32.51968503937,5.9842519685039,11.701935,"N/A","N/A","07/01/2021",64,8,3,"N/A"
"https://amazon.com/dp/B08HFW4VY4","B08HFW4VY4","HALO 100% Cotton Sleepsack Swaddle, 3-Way Adjustable Wearable Blanket, TOG 1.5, Wildflower, Newborn, 0-3 Months","HALO","FBM","Baby Products",70,"Swaddling Blankets",29.99,-1,26044,3,781059.56,30979,4.7,"Best Junction Price",1,203933,5,"Large Standard-Size",8.9370078740157,11.181102362205,1.6929133858268,0.58653,"N/A","N/A","10/01/2022",29,4,121,0.84
"https://amazon.com/dp/B0058O7CXG","B0058O7CXG","KidCo F200 BabySteps Freezer Storage Tray (2 Freezer Trays)","KidCo","FBM","Baby Products",235952,"Food Storage",29.99,"N/A",0,0,0,"N/A","N/A","Double Use",1,1,"N/A","Large Standard-Size",4.9,2.3,11.4,0.80013694068,"N/A","N/A","04/01/2022",104,3,0,"N/A"
"https://amazon.com/dp/B08MWB8D28","B08MWB8D28","ZJW Chicken Diapers, Duck Diapers, Adjustable Poultry Cloth, Washable and Reusable, Suitable for Holidays, Birthdays, Celebration Party Gifts (Green S.)","ZJW","FBA","Baby Products",70479,"Covers",5.99,"N/A",1,0,5.99,37,3.1,"big big apple",1,22,-86,"Small Standard-Size",6.38,6.5,0.43,0.130095,7.120456597222221,24.766805555555553,"12/01/2021",28,7,5,0.03
"https://amazon.com/dp/B07NV1WBMQ","B07NV1WBMQ","Kishu Baby Indi - Premium GOTS Certified Organic Bandana Scarf Bib (Peach)","Kishu Baby","FBA","Baby Products",8138,"Bibs & Burp Cloths Sets",11.99,-1,345,-49,0,1116,4.7,"kishubaby",1,7032,-5,"Large Standard-Size",5.31,6.54,1.46,0.07056,20.245591874999995,70.41945,"10/01/2021",49,8,13,0.31
"https://amazon.com/dp/B07JNF8L53","B07JNF8L53","M Orange Mud Transition & Seat Wrap V2.0 (Royal Blue)","M Orange Mud","FBA","Baby Products",39618,"Automotive Seat Protector",44.95,"N/A",61,-97,2741.95,63,4.9,"Orange Mud",1,2236,-52,"Large Standard-Size",7.28,12.13,4.25,1.320795,149.8602534722222,521.2530555555555,"06/01/2021",53,6,9,0.97
"https://amazon.com/dp/B077NJZYPK","B077NJZYPK","Eco by Naty Diaper Bag Green, Made of GOTS Certified Organic Cotton, Magnetic Closure","Eco by Naty","Amazon","Baby Products",56561,"Diaper Bags",14.38,"N/A",4,1500,57.52,62,4.2,"Amazon",1,63,110,"Large Standard-Size",13,16,6.5,2.449755,"N/A","N/A","04/01/2021",50,6,0,0.06
"https://amazon.com/dp/B0B9ZT9GFC","B0B9ZT9GFC","Tiny Twinkle Baby Feeding Bibs 5 Pack Set - Absorbent and Waterproof Baby Bibs for Feeding Infants (Forest 5-Pack)","Tiny Twinkle","FBA","Baby Products",5033,"Drooling Bibs",9.99,-13,346,2429,3456.54,34,4.6,"Tiny Twinkle Shop",2,723,325,"Large Standard-Size",8,0.25,12,6,9.583333333333332,33.33333333333333,"03/01/2023",7,4,8,10.18
"https://amazon.com/dp/B0BB1D58PY","B0BB1D58PY","Tiny Twinkle Baby Feeding Bibs 5 Pack Set - Absorbent and Waterproof Baby Bibs for Feeding Infants (Painted Peony 5-Pack)","Tiny Twinkle","FBA","Baby Products",5033,"Drooling Bibs",9.99,-12,346,2429,3456.54,34,4.6,"Tiny Twinkle Shop",2,723,325,"Large Standard-Size",10.35,10.75,2.72,0.37044,120.84343750000001,420.32500000000005,"03/01/2023",7,4,8,10.18
"https://amazon.com/dp/B092MRQ19H","B092MRQ19H","Pro Goleem Sleep Sack12-18 Months - Cotton Wearable Blanket Baby Toddler Sleeveless Sleeping Sack Bag with 2-Way Zipper, 0.5 TOG Large Sleep Sack for Baby Gifts, Grey","Pro Goleem","FBA","Baby Products",69750,"Wearable Blankets",19.99,85,4,-97,79.96,76,4.2,"dafenqi",1,559,"N/A","Large Standard-Size",11.42,15.04,0.91,0.659295,62.41093444444444,217.0815111111111,"01/01/2022",23,7,11,0.05
"https://amazon.com/dp/B09DKH81MZ","B09DKH81MZ","Maternity Robe with Swaddle Blanket, Mommy Robe Hospital Labor Delivery Nightgown Nursing Wear（with Gift Box） (A18 Robe+Swaddle, L)","QTECLOR","FBA","Baby Products",59857,"Swaddling Blankets",15.99,-28,8,8,127.92,80,4.5,"QTECLOR",1,484,"N/A","Large Standard-Size",6.6929133858268,11.732283464567,2.3622047244094,1.323,74.06629806697858,257.6219063199255,"05/01/2022",16,7,24,0.1
"https://amazon.com/dp/B09DSSKRPK","B09DSSKRPK","YHOTA 20 Pcs Laser Cut Wedding Invitations Card Pocket with Envelope for Birthday Party Baby or Bride Shower Invite Fit for 5 * 7 Inches Insert Sheet (Dark Blue, 20 pcs)","YHOTA","FBA","Baby Products",69342,"Gift Sets",17.99,"N/A",5,0,89.95,14,4.7,"YHOTA Store",2,30,"N/A","Large Standard-Size",6.1,8.46,1.34,0.71001,27.612793749999994,96.04449999999999,"02/01/2022",17,8,6,0.36
"https://amazon.com/dp/B09GKGG4XG","B09GKGG4XG","INTATIKOO Hollow Teether Tube-Teething Toy for Babies Over 0 Months for Baby-Soft Silicone Infant Teether Straw BPA Free Safe Toddler Sensory Chewing Stick Long Molar Chew Toy (5 Packs, 5 Colors)","Intatikoo","FBA","Baby Products",20785,"Teethers",9.99,"N/A",149,770,1488.51,138,4.5,"intatikoo",1,919,"N/A","Large Standard-Size",5.28,9.13,1.1,0.240345,21.17399166666667,73.64866666666667,"02/01/2023",18,6,20,1.08
"https://amazon.com/dp/B09BCVP4K8","B09BCVP4K8","Large Area Rugs Vintage Spooky Cats and Halloween Pumpkins Purple Living Room Bedroom Indoor Carpet Floor Mat with Non-Slip Bottom, Rectangle Non-Slip Rug for Home Decor Play Room Children Rug, 5'x7'","Jdadrh","FBM","Baby Products",258977,"Outdoor Décor",89.98,"N/A",0,0,0,"N/A","N/A","SecondHao",1,"N/A","N/A","N/A","N/A","N/A","N/A","N/A","N/A","N/A","-",19,6,4,"N/A"
"https://amazon.com/dp/B09815KKZR","B09815KKZR","Paper Clever Party Lumberjack Bring a Book Cards for Baby Shower (25 Pack) Bear Invitation Insert for Boys or Girls Parties – Rustic Theme Red and Black – 4x4 Printed Card Set","Paper Clever Party","FBA","Baby Products",148493,"Gift Sets",9.99,-14,2,700,19.98,1,5,"Paper Clever Party",1,9,"N/A","Small Standard-Size",4.09,4.13,0.47,0.310905,3.1701263368055552,11.026526388888888,"02/01/2023",21,7,0,2
"https://amazon.com/dp/B09DL76C77","B09DL76C77","Toddler Pillowcases Set of 2 - Baby Toddler Travel Pillowcase for Hair and Skin, 100% Cotton Pillow Cases, Ultra Soft Baby Kids Pillowcase for Sleeping Fit Pillow Sized 12"" x 16"" - Light Blue","Ready To Rest","FBM","Baby Products",176834,"Pillowcases",15.99,"N/A",0,0,0,1,5,"Ready To Rest",1,2,"N/A","N/A","N/A","N/A","N/A","N/A","N/A","N/A","01/01/2022",18,8,80,0
"https://amazon.com/dp/B099BGVSG9","B099BGVSG9","Bugaboo Fox 3 Complete Full-Size Stroller - The Most Advanced Comfort Stroller -Black/Midnight Black-Misty White","Bugaboo","FBM","Baby Products",65873,"Standard",1299,22,25,-43,32475,48,4.6,"Kidsland",1,502,"N/A","Medium Oversize",22.5,34,13,43.057035,"N/A","N/A","11/01/2022",19,6,5,0.52
"https://amazon.com/dp/B07DPMSSTG","B07DPMSSTG","DEEKA 12 PCS 6"" Glitter Grosgrain Ribbon Large Hair Bow Alligator Clips for Little Girls","DEEKA","FBA","Baby Products",55406,"Hair Accessories",14.99,"N/A",8,-126,119.92,435,4.6,"DEEKA",1,742,-66,"Large Standard-Size",8.31,10.63,2.01,0.350595,70.89827984374999,246.6027125,"12/01/2021",57,9,8,0.02
"https://amazon.com/dp/B08T726LMC","B08T726LMC","Sugar Mountain North Carolina Ski Adventures Souvenir 2 Inch Vinyl Decal Sticker Mountain Design 4-Pack","R and R Imports","FBM","Baby Products",266321,"Wall Stickers & Murals",14.99,"N/A",0,0,0,"N/A","N/A","College Gear Store",1,"N/A","N/A","N/A","N/A","N/A","N/A","N/A","N/A","N/A","-",24,4,6,"N/A"
"https://amazon.com/dp/B08YXNMW4P","B08YXNMW4P","1.5"" Thank You Stickers, Thank You for Small Business Stickers, Thank You Stickers Roll, Handmade Stickers for Delivery, Decoration, Gifts, Packaging, Party, Easter Gifts, Bakery Boxes, 500PCS/Roll","Likveygud","FBA","Baby Products",131623,"Gift Sets",5.59,"N/A",1,100,5.59,1,5,"loveshopping-amz",1,14,"N/A","Large Standard-Size",3.3858267716535,3.5826771653543,1.9685039370079,0.297675,9.534854070801677,33.164709811484094,"02/01/2023",24,7,2,1
"https://amazon.com/dp/B08RZ14HN1","B08RZ14HN1","AKOAK 1 Pack Silicone Children's Hand Washing AIDS Cartoon Faucet Extension Device Household Kitchen Splash Proof Universal Sink Pilot(Pretty Pink)","AKOAK","FBM","Baby Products",167982,"Bathroom Safety",7.12,"N/A",1,0,7.12,2,5,"AKOAK",1,4,-50,"Large Standard-Size",3.35,4.29,1.65,0.090405,"N/A","N/A","06/01/2021",26,9,3,0.5
"https://amazon.com/dp/B08DTHHYV9","B08DTHHYV9","ONTA Baby Teething Toys Easy to Hold Dinosaur Teether Ball Food Grade Silicone Lightweight, Flexible and Durable Infant Pacifier Soothe Gums and Stimulate Tactile Sense Best Baby Gift","ONTA","FBA","Baby Products",73015,"Teethers",12.99,"N/A",19,-75,246.81,30,4.5,"MIN LONG",1,793,39,"Large Standard-Size",3.740157480315,3.740157480315,3.740157480315,0.2205,20.891759542432695,72.66698971280938,"12/01/2021",20,8,0,0.63
"https://amazon.com/dp/B08XY8QHMV","B08XY8QHMV","Hudson Baby Unisex Baby Cotton Bibs, Sweetest Cupcake, One Size","Hudson Baby","FBM","Baby Products",2824,"Socks",14.99,"N/A",1624,-87,24343.76,9217,4.7,"Hudson Childrenswear",2,60393,28,"Large Standard-Size",8.1889763779528,13.464566929134,1.6929133858268,0.33075,"N/A","N/A","10/01/2022",24,9,116,0.18
"https://amazon.com/dp/B08PZ2Z8F7","B08PZ2Z8F7","LVYZIHO Custom Baby Blanket - Cute Elephant Sleeping on The Moon Baby Blanket - 60 x 80 Inches - Fleece Baby Blanket- Baby Birth Announcement Gift","LVYZIHO","FBM","Baby Products",223387,"Swaddling Blankets",68.96,"N/A",0,0,0,"N/A","N/A","MagicPillow",1,"N/A","N/A","N/A","N/A","N/A","N/A","N/A","N/A","N/A","03/01/2021",23,5,24,"N/A"
"https://amazon.com/dp/B010NDPQVG","B010NDPQVG","Mountain Buggy Juno Carrier Bundle, Black","Mountain Buggy","-","Baby Products",107865,"Carriers & Accessories",89.88,"N/A",1,200,89.88,33,3.9,,1,28,833,"Large Standard-Size",10.866141732283,6.7716535433071,11.811023622047,2.9105702906368,"N/A","N/A","08/01/2022",15,10,4,0.03
"https://amazon.com/dp/B08PDQJ238","B08PDQJ238","Ely's & Co. Changing Pad Cover Set | Cradle Sheet Set 100% Cotton Jersey Knit 2 Pack (White)","Ely's & Co.","FBA","Baby Products",7823,"N/A",20.99,"N/A",438,66,9193.62,615,4.8,"A Top Shelf",1,4622,58,"Large Standard-Size",6,8,1.5,0.59976,28.749999999999996,99.99999999999999,"08/01/2022",14,5,6,0.71
"https://amazon.com/dp/B09FFSQ2R7","B09FFSQ2R7","Meerdif Baby Bandana Drool Bibs 10 Pack Solid Organic Cotton Baby Bibs for Boys, Girls, Unisex - Plain Colors","Meerdif","FBA","Baby Products",57126,"Drooling Bibs",19.95,13,5,-97,99.75,310,4.7,"FJZ Traders",1,876,"N/A","Large Standard-Size",8.27,8.86,2.56,0.441,74.9004711111111,260.52337777777774,"04/01/2021",17,7,2,0.02
"https://amazon.com/dp/B098NCB9MS","B098NCB9MS","SPOKKI 4 Pcs Newborn Photography Props Outfits- Baby Long Ripple Wrap and Toddler Swaddle Blankets Photography Mat with Cute Headbands for Infant Boys Girls(0-12 Months) (White+Beige)","SPOKKI","FBA","Baby Products",20348,"Swaddling Blankets",20.99,-5,263,-19,5520.37,1683,4.4,"PJ House",1,4907,-45,"Large Standard-Size",7.72,9.76,3.66,0.769545,110.11679333333333,383.0149333333333,"05/01/2021",20,8,6,0.16
"https://amazon.com/dp/B09BCKBZMM","B09BCKBZMM","Babygoal Halloween Pacifier Clips, 6 Pack Pacifier Holder for Boys and Girls Fits Most Pacifier Styles & Baby Teething Toys and Baby Gift 6PB10","babygoal","FBA","Baby Products",7474,"Pacifier Accessories",6.99,"N/A",502,-48,3508.98,7246,4.7,"babygoal",1,14521,"N/A","Small Standard-Size",5.55,6.38,0.67,0.130095,9.473136979166664,32.950041666666664,"01/01/2022",20,9,16,0.07
"https://amazon.com/dp/B09H6T34KK","B09H6T34KK","HONGID Night Light for Kids,Kids Night Lights Projector,2 in 1 Boys Girls Room Decor,Christmas Xmax Birthday Gifts for Children,Cool Light Sensory Aesthetic Room Decor-White","HONGID","FBA","Baby Products",62704,"Night Lights",11.99,16,267,-125,0,5662,4.3,"ToyKidsDirect",1,22191,"N/A","Large Standard-Size",5.08,5.08,4.37,0.729855,45.03127194444444,156.6305111111111,"12/01/2022",17,7,0,0.05
"https://amazon.com/dp/B09GLTBQFZ","B09GLTBQFZ","Cuteoy Baby’s First Christmas Stocking My First Christmas Baby Boy and Girl Xmas Stockings Gift for Newborn Baby Ornament Home Family Decor, Blue, 20’’","Cuteoy","FBA","Baby Products",65796,"Gift Sets",13.98,"N/A",3,-140,41.94,66,4.9,"Cuteoy",1,641,"N/A","Large Standard-Size",11.61,11.77,2.05,0.18081,111.85821796874997,389.0720624999999,"12/01/2022",17,6,2,0.05
"https://amazon.com/dp/B00FT2MV4W","B00FT2MV4W","Kalencom Potette Plus Liners - 30 Liners Pack of 2","Kalencom","FBA","Baby Products",29045,"Potties",29.99,"N/A",9,-45,269.91,87,4.5,"New Clouet",1,83,102,"Large Standard-Size",6.4,9.7,2.6,1.04958,64.45111111111109,224.17777777777772,"11/01/2022",98,5,0,0.1
"https://amazon.com/dp/B01BHX9FW2","B01BHX9FW2","Modish Labels, 12 Monthly Baby Stickers, Baby Boy, Woodland, Deer, Antlers, Buck, Baby Month Stickers, First Year Stickers, Chevron, Tan, Beige, Blue, Navy, Gray, Grey, Baby Book Keepsake, Photo Prop","Modish Labels","FBM","Baby Products",79581,"Wall Stickers & Murals",10.95,"N/A",2,-44,21.9,152,4.8,"Modish Labels",1,41,-79,"Small Standard-Size",8.4645669291339,10.944881889764,0.35433070866142,0.12789,"N/A","N/A","03/01/2021",86,9,0,0.01
"https://amazon.com/dp/B0BFH56PRX","B0BFH56PRX","Baby Formula Mixer Milk Mixer for Baby Automatic Baby Milk Bottle Shaker Hands Free Electric Mixed Milk Powder Blender for Infant Formula Mixer Fits All Baby Bottles","Homshe","FBA","Baby Products",140842,"Bottles",32.99,-5,0,-133,0,1,1,"Jians-US",1,"N/A","N/A","Large Standard-Size",5.91,6.54,5.35,1.15101,82.5703953125,287.201375,"12/01/2022",6,7,0,0
"https://amazon.com/dp/B09ZD3V2QM","B09ZD3V2QM","StickerPR Truck Tractor Custom Name Wall Sticker Vinyl Decal for Babys Room Personalized Stickers Wallpaper Kids Bedroom Decor Wall Decals (Design 2)","StickerPR","FBM","Baby Products",65006,"Home Décor Accents",14.99,"N/A",37,49,554.63,3,3.5,"StickerPR",1,"N/A","N/A","N/A","N/A","N/A","N/A","N/A","N/A","N/A","12/01/2022",3,6,6,12.33
"https://amazon.com/dp/B0B9WTW1TC","B0B9WTW1TC","20 Pack Green Baby Nursery Closet Hangers,Non-Slip Laundry Infant Pant Hanger for Newborn Clothes Gift,Ultra-Thin Child Coat Hanger for Girl Boy Toddler Kid","VIIBASE","FBA","Baby Products",22168,"Children's Clothes Hangers",10.99,37,425,,4670.75,148,4.5,"RUOLIU",1,"N/A","N/A","Large Standard-Size",9.53,9.57,1.93,0.82026,70.28578505208333,244.47229583333333,"02/01/2023",639,7,35,3.6
"https://amazon.com/dp/B0BQRTL2NP","B0BQRTL2NP","Personalized Baby Name Blanket for Boys and Girls Custom Baby Blanket with Name Super Soft Personalized Gift Name Blanket for Shower Birthday Valentine's Day Memorial Day","Eyesoul","FBM","Baby Products",86720,"Bed Blankets",12.99,"N/A",8,16,103.92,"N/A","N/A","ESMOVE-Online",1,"N/A","N/A","N/A","N/A","N/A","N/A","N/A","N/A","N/A","02/01/2023",639,7,48,"N/A"
"https://amazon.com/dp/B0BPLFM4NQ","B0BPLFM4NQ","MooMoo Baby Fleece Sleep Sack with Feet Toddler Wearable Blanket Sleeveless Baby Sleeping Sack with Legs Boys 2T-3T","MooMoo Baby","FBA","Baby Products",28440,"Wearable Blankets",16.99,"N/A",37,88,628.63,"N/A","N/A","MooMoo Baby Collection",1,334,"N/A","Large Standard-Size",8.54,12.4,1.97,0.48951,83.30117638888886,289.7432222222222,"10/01/2022",639,7,16,"N/A"
"https://amazon.com/dp/B0BHXC8FWC","B0BHXC8FWC","Momcozy Original Supportive Pumping Bra Hands Free, Upgraded Comfort Smooth Fabric Pumping and Nursing Bra in One Suitable for Breastfeeding-Pumps by Lansinoh, Philips Avent, Spectra and More Black","Momcozy","FBA","Baby Products",76912,"Nursing Pads",29.99,"N/A",1,-117,29.99,10,3.5,"Teamsun",1,"N/A","N/A","Large Standard-Size",6.46,10.04,1.69,0.29106,43.7681598611111,152.23707777777773,"11/01/2022",5,7,10,0.1
"https://amazon.com/dp/B0BHWZP51P","B0BHWZP51P","Momcozy Original Supportive Pumping Bra Hands Free, Upgraded Comfort Smooth Fabric Pumping and Nursing Bra in One Suitable for Breastfeeding-Pumps by Lansinoh, Philips Avent, Spectra and More Black","Momcozy","FBA","Baby Products",76912,"Nursing Pads",29.99,"N/A",1,-117,29.99,10,3.5,"Teamsun",1,"N/A","N/A","Large Standard-Size",6.73,10.08,1.77,0.310905,47.9462025,166.7694,"11/01/2022",5,7,10,0.1
"https://amazon.com/dp/B0B8MR59RR","B0B8MR59RR","LAT Baby Sleep Bag with Feet Winter, Wearable Blanket with Legs, Sack for Toddler Thicken 2.5 TOG，Stars and Moons (L)","LAT LEE AND TOWN","FBA","Baby Products",77960,"Girls",31.99,-8,17,145,543.83,18,4.9,"Little Jump Group",1,"N/A","N/A","Large Standard-Size",10.35,14.76,2.6,1.04076,158.6008125,551.655,"11/01/2022",8,7,3,0.94
