"https://amazon.com/dp/B07X1XHN7L","B07X1XHN7L","Aphila 5D Diamond Painting Kits for Adults and Beginner Full Drill Round Resin Rhinestone Diamond Embroidery Cross Stitch Arts Craft Supply Home Decor Gift 10x12inches,German Shepherd Dog","Aphila","FBM","Arts, Crafts & Sewing",753293,"Adults' Paint-By-Number Kits",7.99,"N/A",0,0,0,7,3.9,"RENZHI TECH",1,3,-77,"N/A","N/A","N/A","N/A","N/A","N/A","N/A","01/01/2022",32,7,2,0
"https://amazon.com/dp/B0B4V4GB2V","B0B4V4GB2V","3"" 1.5HP DC Solar Water Pump with MPPT Controller 304 Stainless Steel Deep Well Submersible Pump Direct Current Submersible Pump Durable for Home and Industrial Use (3 Inch 110V 1100W)","Leblett","FBM","Tools & Home Improvement",2113782,"Pumps",408,-12,0,0,0,"N/A","N/A","Leblett",1,"N/A","N/A","N/A",5.511811023622,9.0551181102362,43.307086614173,"N/A","N/A","N/A","-",639,9,20,"N/A"
"https://amazon.com/dp/B094R13QN8","B094R13QN8","ohmydear Women Lingerie Bodysuit One Piece Floral Teddy Mesh Sheer Embroidered Bodysuit with Underwire Top Lingerie","ohmydear","FBA","Clothing, Shoes & Jewelry",914595,"Teddies & Bodysuits",14.99,-28,20,460,299.8,66,4.3,"OHMYDEAR",1,"N/A","N/A","Large Standard-Size",8.3070866141732,10.157480314961,1.3385826771654,0.213885,45.100907541056934,156.87272188193717,"03/01/2023",22,6,24,0.3
"https://amazon.com/dp/B08XQQJJZG","B08XQQJJZG","WANGYUSHENG White Gold Silver Tone Women Teardrop Pear Shaped Halo Cubic Zirconia Ring Fashion Engagement Promise Ring (US size 6)","WANGYUSHENG","FBM","Clothing, Shoes & Jewelry",5770956,"Engagement Rings",12.99,"N/A",0,0,0,1,3,"WANGYUSHENG",1,"N/A","N/A","Small Standard-Size",2.28,3.74,0.35,0.03969,"N/A","N/A","-",24,7,5,0
"https://amazon.com/dp/B004EMDPLG","B004EMDPLG","Maxwell Scott | Luxury Leather Travel Wallet | The Torrino | Handmade In Italy | Dark Chocolate Brown","Maxwell Scott Bags","FBM","Clothing, Shoes & Jewelry",5098367,"Travel Wallets",173,"N/A",0,0,0,3,4.8,"Maxwell Scott Bags",1,1,"N/A","Large Standard-Size",8.0314960629921,10,1.3385826771654,0.8379,"N/A","N/A","03/01/2022",114,9,3,0
"https://amazon.com/dp/B0B2MSYYLB","B0B2MSYYLB","SOFIA'S CHOICE Women's Cute Aesthetic Crop Tops Short Sleeve y2k Teen Baby Tees T-Shirts Green Small","SOFIA'S CHOICE","FBM","Clothing, Shoes & Jewelry",128168,"T-Shirts",19.99,25,120,-56,2398.8,106,4.3,"Qianxin E-commerce",1,"N/A","N/A","Large Standard-Size",9.25,17.32,1.18,0.2205,"N/A","N/A","08/01/2022",10,6,50,1.13
"https://amazon.com/dp/B09SXBXB8S","B09SXBXB8S","Madden Girl Women's Ileana Heeled Sandal, Clear Multi Lucite, 7","Madden Girl","Amazon","Clothing, Shoes & Jewelry",325010,"Heeled Sandals",59.99,35,69,4,3587.31,25,4.2,"Amazon",3,1242,"N/A","Large Standard-Size",8.15,12.17,4.25,1.589805,"N/A","N/A","09/01/2022",10,7,81,2.09
"https://amazon.com/dp/B08V1XHMDW","B08V1XHMDW","NIBOKA Short Sleeve Super Heroes Compression Ant Man Tight Man Shirt Gym Sport","NIBOKA","FBM","Clothing, Shoes & Jewelry",1007297,"Shirts",17.99,"N/A",4,-81,71.96,8,4.2,"NIBOKA WIGS",1,135,207,"N/A","N/A","N/A","N/A","N/A","N/A","N/A","06/01/2022",7,4,192,0.5
"https://amazon.com/dp/B09Q25DHZJ","B09Q25DHZJ","BZees Women's Desire Slide Sandal, Folk Stone, 7","BZees","FBA","Clothing, Shoes & Jewelry",40610,"Slides",50.8,-23,585,76,29718,1742,4.4,"Amazin Group",1,"N/A","N/A","Large Standard-Size",7.2,12.01,4.41,1.369305,152.2717875,529.641,"02/01/2023",14,8,117,0.34
"https://amazon.com/dp/B08ZJY5RVG","B08ZJY5RVG","Rockport Men's Total Motion Trek Keota Boot Hiking, Black, 11.5","Rockport","Amazon","Clothing, Shoes & Jewelry",517643,"Chukka",61.6,-13,18,-87,1108.8,62,4.5,"Amazon",1,884,"N/A","Large Standard-Size",11.89,14.33,5.31,3.750705,"N/A","N/A","11/01/2022",19,4,78,0.29
"https://amazon.com/dp/B096N67NMR","B096N67NMR","SUNNY MOOD 8' x 142' Custom Size Green Fence Privacy Screen Windscreen 160 GSM Commercial Grade Mash Material UV Block - Custom Size Accepted","SUNNY MOOD","FBM","Patio, Lawn & Garden",154317,"Decorative Fences",277.09,"N/A",52,28,14408.68,23,4.5,"SUNNY MOOD",1,374,"N/A","N/A","N/A","N/A","N/A","N/A","N/A","N/A","11/01/2021",639,4,1000,2.26
"https://amazon.com/dp/B09ZP82V8Y","B09ZP82V8Y","KOZR Ankle Athletic Running Socks 3/6 Pairs Pack, Low Cut Sports Tab Socks with Cushion for Men and Women","KOZR","FBA","Clothing, Shoes & Jewelry",149854,"Socks",9.99,-5,597,731,5964.03,771,4.5,"KOZR",1,"N/A","N/A","Large Standard-Size",12.17,12.95,1.77,0.549045,111.38814348958331,387.4370208333333,"02/01/2023",9,4,75,0.77
"https://amazon.com/dp/B0B6D3WWXR","B0B6D3WWXR","PUMA Men's Essential No. 1 Logo Tee (Large, Ice Flow)","PUMA","FBM","Clothing, Shoes & Jewelry",106891,"T-Shirts",12.95,-74,168,83,2175.6,338,4.4,"SHOEBACCA",1,605,"N/A","Large Standard-Size",7.4803149606299,10.704724409449,1.0236220472441,0.3969,"N/A","N/A","02/01/2023",9,3,257,0.5
"https://amazon.com/dp/B0B2BXXRXR","B0B2BXXRXR","Nike Womens Blazer Low Platform DQ7654 100 - Size 9W","Nike","FBM","Clothing, Shoes & Jewelry",17830,"Women's",117.99,2,1509,-22,178046.91,354,4.4,"JMsneakers",1,11009,"N/A","Large Standard-Size",8.23,13.5,5,2.489445,"N/A","N/A","01/01/2023",10,5,157,4.26
"https://amazon.com/dp/B0913J7TPC","B0913J7TPC","LA MINU - Wireless F9 Earbuds with Touch Control, Bluetooth Earphones Fingerprint Touch Headset HiFi Stereo in-Ear Headphones for Sport","LA MINU","FBA","Electronics",258181,"Earbud Headphones",16.98,"N/A",0,0,0,24,3.7,"LAMINU LLC",1,"N/A","N/A","Large Standard-Size",3.6614173228346,4.5275590551181,1.9685039370079,0.24255,13.030317440228037,45.3228432703584,"09/01/2022",24,9,0,0
"https://amazon.com/dp/B09GF4XX2R","B09GF4XX2R","STACY ADAMS Men's Rodano Cap Toe Oxford, Gray, 9.5 Wide","STACY ADAMS","FBM","Clothing, Shoes & Jewelry",218555,"Oxfords",104.95,"N/A",69,84,7241.55,58,4.4,"ShoeMall",0,"N/A","N/A","Large Standard-Size",7.4,13.54,4.72,2.4696,"N/A","N/A","02/01/2023",12,8,126,1.19
"https://amazon.com/dp/B09V6XZ5WP","B09V6XZ5WP","Skechers Women's GO Walk Pant, Pewter, L","Skechers","Amazon","Clothing, Shoes & Jewelry",3757,"Clothing",49,5,7073,0,346577,7056,4.6,"Amazon",1,"N/A","N/A","Large Standard-Size",10.787401574803,14.645669291339,2.3228346456693,0.90846,"N/A","N/A","02/01/2023",10,2,196,1
"https://amazon.com/dp/B08TB6WQQM","B08TB6WQQM","Oakley Men's Perf 5 Utility Short, Lunar Rock, 36","Oakley","FBM","Clothing, Shoes & Jewelry",437240,"Shorts",69.95,46,32,-17,2238.4,51,4.4,"Surfboards Etc",1,973,"N/A","Large Standard-Size",10.67,14.37,1.81,0.460845,"N/A","N/A","06/01/2022",24,2,79,0.64
"https://amazon.com/dp/B0B5QRP467","B0B5QRP467","Juliet Holy Girls Round Toe Side Zipper Ankle Boots Non-Slip Kids Cute Bow Snow Booties Winter Outdoor Comfortable Shoes","Juliet Holy","FBA","Clothing, Shoes & Jewelry",935665,"Boots",29.99,-31,5,-111,149.95,45,4.8,"Govocota",1,"N/A","N/A","Large Standard-Size",8.58,10.55,3.9,1.7199,140.964484375,490.3112500000001,"09/01/2022",8,7,45,0.11
"https://amazon.com/dp/B0B427KCL4","B0B427KCL4","SheIn Women's Casual Sleeveless Halter Top Rib Knit Solid Tanks Shirt Grey X-Small","SheIn","FBM","Clothing, Shoes & Jewelry",207298,"Tanks & Camis",16.99,-25,159,128,2701.41,155,3.8,"Ao Mao online store",1,2682,"N/A","Large Standard-Size",9.72,11.77,0.83,0.14994,"N/A","N/A","08/01/2022",8,5,41,1.03
"https://amazon.com/dp/B09JVL74B6","B09JVL74B6","Arjen Kroos Men's Sexy Thong Breathable Mesh Briefs Bulge Pouch Underwear","Arjen Kroos","FBM","Clothing, Shoes & Jewelry",141172,"Boxer Briefs",7.99,-1,201,-29,1605.99,262,4.4,"OZZEG",1,2439,"N/A","Small Standard-Size",5.5511811023622,6.9685039370079,0.47244094488189,0.07938,"N/A","N/A","02/01/2022",17,7,120,0.77
"https://amazon.com/dp/B091FF1V1S","B091FF1V1S","Gdrasuya10 63.5x20x13.5cm DIY Office Wood Desk Organizer File Storage Monitor Stand Riser Desktop Tray with Lock Drawer for Laptop Desktop Computer Printer Cellphone Burlywood","Gdrasuya10","FBM","Office Products",982480,"Home Office Desks",47,"N/A",0,0,0,1,1,"Faithe Cecillia",1,"N/A","N/A","N/A","N/A","N/A","N/A","N/A","N/A","N/A","-",24,9,2,0
"https://amazon.com/dp/B0B9KPVS19","B0B9KPVS19","Diaper Bag Backpack with Changing Station, Large Baby Bags for Girl Boys Dad Mom, Baby Shower Gifts, Baby Registry Search, Baby Stuff for Newborn Essentials Must Haves Items, Leopard","PLOKUO","FBA","Baby Products",65870,"Backpacks",37.99,"N/A",6,50,227.94,62,4.6,"PLOKUO",1,3913,"N/A","Large Standard-Size",13.23,16.5,3.15,2.890755,274.5741796875,955.0406250000001,"08/01/2022",7,6,5,0.1
"https://amazon.com/dp/B0B87WXDP9","B0B87WXDP9","Verdusa Women's Criss Cross Backless Strappy Asymmetrical Hem Crop Cami Top Brown XS","Verdusa","FBA","Clothing, Shoes & Jewelry",31752,"Tanks & Camis",18.99,8,1448,255,27497.52,299,4,"Verdusa",1,12684,"N/A","Large Standard-Size",8.94,12.09,1.85,0.130095,79.8437453125,277.717375,"08/01/2022",7,5,90,4.84
"https://amazon.com/dp/B09V8XZDPD","B09V8XZDPD","Rae Dunn St. Patrick's Gnome - 11 Inch Trio Stuffed Plush Figurine Dolls with Felt Hats - Cute Ornaments and Holiday Decorations for Home Decor and Office","Rae Dunn","FBA","Toys & Games",266339,"Plush Figures",29.99,"N/A",75,0,2249.25,7,4.8,"Giftshop USA",2,"N/A","N/A","Large Standard-Size",12.83,13.19,4.09,2.1609,276.37586352430554,961.3073513888888,"02/01/2023",7,2,4,10.71
"https://amazon.com/dp/B08QRY9BB9","B08QRY9BB9","Superdry Mens Organic Cotton Code Essential Zip Hoodie, Loose Fit Black Size M","Superdry","FBM","Clothing, Shoes & Jewelry",1011136,"Fashion Hoodies & Sweatshirts",48.97,16,0,-125,0,29,4.7,"Official Superdry",1,39,"N/A","Large Standard-Size",12.48031496063,15.944881889764,2.5984251968504,2.0727,"N/A","N/A","11/01/2022",16,7,54,0
"https://amazon.com/dp/B00LFKA8PQ","B00LFKA8PQ","Pearl Izumi - Ride Men's Elite LTD Jersey, Shadow Grey, Small","PEARL IZUMI","Amazon","Clothing, Shoes & Jewelry",3971034,"Cycling Jerseys",110,"N/A",0,-100,0,100,4.3,"Amazon",2,2,-71,"Large Standard-Size",13.7,3.1,10.1,0.3500599115475,"N/A","N/A","06/01/2021",92,1,183,0
"https://amazon.com/dp/B0B2RSRH8J","B0B2RSRH8J","Vionic Women's Pearl Elora Classic Loafer Leather Flats- Supportive Ladies Slip On Shoes That Include Three-Zone Comfort with Orthotic Insole Arch Support, Medium Fit Army Green 10 Medium US","Vionic","FBA","Clothing, Shoes & Jewelry",203910,"Loafers & Slip-Ons",129.94,41,123,-39,15982.62,42,3.5,"Care Wear Uniforms Inc./Heavenly Shoes Inc.",1,"N/A","N/A","Large Standard-Size",7.8,12.09,4.84,1.90071,182.25171249999997,633.9189999999999,"10/01/2022",7,7,0,2.93
"https://amazon.com/dp/B09X49791F","B09X49791F","BCBG Wrap Pants Black MD (US 6-8)","BCBGMAXAZRIA","FBA","Clothing, Shoes & Jewelry",4947239,"Pants",95.25,-79,0,-100,0,1,1,"6pm",1,"N/A","N/A","Large Standard-Size",10.94,13.43,1.38,0.89964,80.96135604166665,281.6047166666666,"01/01/2023",8,1,4,0
"https://amazon.com/dp/B09C92CN91","B09C92CN91","inktastic Miniature Pinscher Dog Cute Baby Bodysuit 24 Months Indigo 3cd50","inktastic","FBM","Clothing, Shoes & Jewelry",10634005,"Bodysuits",19.99,"N/A",0,0,0,"N/A","N/A","Inktastic",1,"N/A","N/A","N/A","N/A","N/A","N/A","N/A","N/A","N/A","-",7,3,157,"N/A"
"https://amazon.com/dp/B09ZLCGKQQ","B09ZLCGKQQ","Trump 2024 Blankets Super Soft for Bed Couch Sofa Fuzzy Warm Cozy Lightweight Throw for Friend Adults Women Men 40""x30"" Extra Small for Pets","Taishakuten","FBM","Home & Kitchen",2639330,"Throws",9.99,"N/A",0,-144,0,3,5,"Taishakuten",1,"N/A","N/A","N/A","N/A","N/A","N/A","N/A","N/A","N/A","11/01/2022",8,7,140,0
"https://amazon.com/dp/B0B1J6ZKG7","B0B1J6ZKG7","Spooktacular Creations Adult Women Ancient Roman Empress Costume Toga Costume Greek Goddess Outfits Set for Halloween Dress Up Party, Role Play, Cosplay Theme Party-M","Spooktacular Creations","FBA","Clothing, Shoes & Jewelry",513578,"Costumes",26.99,"N/A",15,0,404.85,13,4.1,"JoyinDirect",1,"N/A","N/A","Large Standard-Size",11.46,14.09,1.69,0.990045,108.96516177083333,379.0092583333334,"10/01/2022",9,7,3,1.15
"https://amazon.com/dp/B096LKGVPC","B096LKGVPC","American Exchange Boys' Duck Boots - Navy, 10 Toddler","American Exchange","FBM","Clothing, Shoes & Jewelry",13563678,"Boots",19.99,"N/A",0,0,0,"N/A","N/A","COOKIESKIDS",1,"N/A","N/A","Large Standard-Size",5,5,1,0.5,"N/A","N/A","-",11,3,0,"N/A"
"https://amazon.com/dp/B09GK5MJRP","B09GK5MJRP","Capbier Toddler Infant Baby Girl Boy Knit Crewneck Sweater Blouse Pullover Oversized Sweatshirt Long Sleeve Tops Fall Winter Clothes, B-beige Pink, 4-5T","Capbier","FBM","Clothing, Shoes & Jewelry",199639,"Sweaters",11.99,"N/A",133,4,1594.67,49,4.5,"Simssic 7-12 Days Arrival",1,1731,"N/A","N/A","N/A","N/A","N/A","N/A","N/A","N/A","11/01/2022",18,7,96,2.71
"https://amazon.com/dp/B0914Z8C84","B0914Z8C84","UG Apparel Women's Plus Everyday Tunic, Navy, 3X","UG Apparel","Amazon","Clothing, Shoes & Jewelry",539543,"Tunics",11.23,"N/A",38,-50,426.74,53,4.1,"Amazon",1,1461,"N/A","Large Standard-Size",12.362204724409,15.196850393701,1.8897637795276,0.562275,"N/A","N/A","10/01/2022",12,3,207,0.72
"https://amazon.com/dp/B00661YCYM","B00661YCYM","Pearl Izumi Women's White Sugar Short, White/Safety Orange, XX-Large","PEARL IZUMI","Amazon","Clothing, Shoes & Jewelry",4936835,"Shorts",55,"N/A",0,0,0,24,3.5,"Amazon",2,"N/A","N/A","Large Standard-Size",8.1,1.9,9.3,0.45,"N/A","N/A","07/01/2022",24,4,30,0
"https://amazon.com/dp/B094YG15Y4","B094YG15Y4","ZFRXIGN Tribal Dreamcatcher Sun Shade for Auto Front Windshield Sunshade Cars Window Sunshade Blocks UV Rays Sun Visor Protector Boho Feather Galaxy Purple 2 Pieces","ZFRXIGN","FBM","Automotive",733756,"Windshield Sunshades",19.99,"N/A",1,-115,19.99,86,4.4,"CHULIMO",1,211,-54,"Large Standard-Size",11.81,12.87,1.73,0.441,"N/A","N/A","08/01/2021",21,7,57,0.01
"https://amazon.com/dp/B09DTPLTKL","B09DTPLTKL","Power Healing Crystals Polished Selenite Charging Square Plate/Tile Slab, Natural Selenite Plate for Cleansing, Metaphysical Meditation, Charging Crystals (Medium 2"" x 4"" x 0.75"", Weight: 9 Oz)","Power Healing Crystals","FBM","Health & Household",986002,"Healing Crystals",19,"N/A",0,0,0,1,5,"Delphine Callegher Art",1,"N/A","N/A","N/A","N/A","N/A","N/A","N/A","N/A","N/A","11/01/2021",18,7,2,0
"https://amazon.com/dp/B094QLK8JH","B094QLK8JH","Mushugu Novice Flame Shaped Electric Guitar HSH Pickup Bag Strap Paddle Rocker Cable Wrench Tool, give away tremolo arm,Dark Blue","Mushugu","FBM","Musical Instruments",177786,"Beginner Kits",126.99,"N/A",0,0,0,1,5,"wang li lan bai huo dian",1,"N/A","N/A","N/A","N/A","N/A","N/A","N/A","N/A","N/A","08/01/2022",7,7,4,0
"https://amazon.com/dp/B08WPSG7VM","B08WPSG7VM","Jessica London Women's Plus Size Jegging Legging Stretch Pants - 12 W, Black","Jessica London","FBM","Clothing, Shoes & Jewelry",1360843,"Leggings",33.88,1,4,650,135.52,5,3.2,"Jessica London",1,"N/A","N/A","Large Standard-Size",14,3,18,0.9,"N/A","N/A","02/01/2023",18,5,66,0.8
"https://amazon.com/dp/B094RHZSLK","B094RHZSLK","inktastic My Mommy Loves Me Sloth Baby Bodysuit 18 Months Vintage Camo 2a708","inktastic","FBM","Clothing, Shoes & Jewelry",6117887,"Bodysuits",21.99,"N/A",0,0,0,1,5,"Inktastic",1,"N/A","N/A","N/A","N/A","N/A","N/A","N/A","N/A","N/A","-",7,3,108,0
"https://amazon.com/dp/B0BB71M9LR","B0BB71M9LR","Gray Baby Onesie 12 Month Onesie Boy Girls Fall Summer Bodysuit My Siblings Have Paws","BFUSTYLE","FBA","Clothing, Shoes & Jewelry",8679,"Bodysuits",6.98,"N/A",3233,69,22566.34,4607,4.8,"Awardrobe",1,"N/A","N/A","Small Standard-Size",8.1,9.5,0.6,0.099225,18.435937499999998,64.125,"02/01/2023",7,7,151,0.71
"https://amazon.com/dp/B093Y5T1TL","B093Y5T1TL","Chalk Mountain Brushes 100% All Natural Furniture Finishing Waxes. Safe to use Indoors. Beautifys and Protects Painted and Unfinished Wood. Made in USA (8oz Dark Antiquing)","Chalk Mountain Brushes","FBM","Tools & Home Improvement",539903,"Interior & Exterior House Paint",21.99,7,22,-48,483.78,425,4.4,"Chalk Mountain Supply Co.",1,733,-11,"N/A","N/A","N/A","N/A","N/A","N/A","N/A","07/01/2022",22,6,30,0.05
"https://amazon.com/dp/B07937WK8L","B07937WK8L","CALTO Men's Invisible Height Increasing Elevator Shoes - Camo Black/Yellow Canvas Lightweight Lace-up Casual Trainers Sneakers - 3.2 Inches Taller - H2244 - Size 6 D(M) US","CALTO","FBA","Clothing, Shoes & Jewelry",6640753,"Fashion Sneakers",24.99,-1,0,0,0,3,2.1,"Tallmenshoes",1,1,0,"Large Standard-Size",10.43,14.06,4.84,3.17079,283.4133759722222,985.7856555555554,"03/01/2021",38,7,8,0
"https://amazon.com/dp/B09Q83F6DP","B09Q83F6DP","XYAYE V Neck Long Sleeve Teal Bridesmaid Dresses for Women Simple A-line Formal Party Gowns with Slit 18 Plus Size","XYAYE","FBM","Clothing, Shoes & Jewelry",504937,"N/A",78.98,"N/A",16,1020,1263.68,3,5,"FFZU",2,"N/A","N/A","N/A","N/A","N/A","N/A","N/A","N/A","N/A","02/01/2023",639,7,630,5.33
"https://amazon.com/dp/B09RNBBVQ2","B09RNBBVQ2","Calvin Klein Men's Cotton Classics 6-Pack Brief, Black Bodies W/Ocean HUE, Tuscan Terra Cotta, Grey Heather, DEEP Moat Blue, Storm Cloud, Black WBS, XL","Calvin Klein","FBA","Clothing, Shoes & Jewelry",68418,"Briefs",49.98,-7,434,985,21691.32,1983,4.6,"Flow Dealz",1,2217,"N/A","Large Standard-Size",7.6771653543307,9.1732283464567,3.9370078740157,1.30977,110.71200989186617,385.08525179779537,"05/01/2022",11,5,25,0.22
"https://amazon.com/dp/B08WTCP4RY","B08WTCP4RY","DKNY Girls' Big 2 pcs. Set, Bright White, 10 Years","DKNY","Amazon","Clothing, Shoes & Jewelry",160168,"Pant Sets",20.85,-10,195,-5,4065.75,943,4.6,"Amazon",1,5554,521,"Large Standard-Size",8.07,10.12,1.65,0.48951,"N/A","N/A","08/01/2022",22,5,479,0.21
"https://amazon.com/dp/B09VL7SHM6","B09VL7SHM6","Burgundy Sequin One Shoulder Prom Dresses for Women Long Mermaid Formal Dress and Party Gowns with Slit 0","Stylefun","FBM","Clothing, Shoes & Jewelry",224616,"N/A",59.99,-43,122,0,7318.78,8,5,"Teamoluna",2,"N/A","N/A","N/A","N/A","N/A","N/A","N/A","N/A","N/A","02/01/2023",7,7,0,15.25
"https://amazon.com/dp/B00LXUW9SC","B00LXUW9SC","Pearl Izumi - Ride Men's Elite Sleeveless Jersey, Mykonos Blue/Blue Atoll, Small","PEARL IZUMI","Amazon","Clothing, Shoes & Jewelry",3599259,"Cycling Jerseys",90,"N/A",0,0,0,38,4.2,"Amazon",2,12,71,"Large Standard-Size",1,1,1,1,"N/A","N/A","06/01/2022",31,2,69,0
"https://amazon.com/dp/B0872PM1YL","B0872PM1YL","Sexy Women Satin Sleepwear Set Women Ladies Leopard Print Nightwear Nightdress Set Lingerie with Chest Pads Night Dress","Bolayu","FBM","Clothing, Shoes & Jewelry",1705170,"Nightgowns & Sleepshirts",25.09,"N/A",1,0,25.09,80,2.7,"BOLAYU 跟卖Suissewi 送fa ren 大礼包",1,34,-90,"N/A","N/A","N/A","N/A","N/A","N/A","N/A","08/01/2021",31,5,96,0.01
"https://amazon.com/dp/B09Q87G6YP","B09Q87G6YP","XYAYE V Neck Bridesmaid Dresses Long for Women Long Sleeve Formal Party Gowns with Slit Sage Green 16 Plus Size","XYAYE","FBM","Clothing, Shoes & Jewelry",504937,"N/A",78.98,"N/A",16,833,1263.68,3,5,"FFZU",2,"N/A","N/A","N/A","N/A","N/A","N/A","N/A","N/A","N/A","02/01/2023",639,7,630,5.33
"https://amazon.com/dp/B09Q7PBVGF","B09Q7PBVGF","XYAYE Chiffon Long Sleeve Bridesmaid Dresses for Women V Neck Formal Party Dresses with Slit Burnt Orange 4","XYAYE","FBM","Clothing, Shoes & Jewelry",504937,"N/A",68.98,"N/A",16,1020,1103.68,3,5,"FFZU",2,"N/A","N/A","N/A","N/A","N/A","N/A","N/A","N/A","N/A","02/01/2023",7,7,630,5.33
"https://amazon.com/dp/B09Y5HBF9X","B09Y5HBF9X","QUALFORT Women's Bamboo Pants Bamboo Wide Leg Pants Stretchy Casual Bottoms Soft Pajama Pants Dark Grey Small","QUALFORT","FBA","Clothing, Shoes & Jewelry",137787,"Bottoms",33.99,"N/A",104,163,3534.96,28,4.4,"QUALFORT",1,"N/A","N/A","Large Standard-Size",10.87,14.29,1.38,0.9702,85.59456947916664,297.7202416666666,"02/01/2023",9,6,35,3.71
"https://amazon.com/dp/B08KFW156V","B08KFW156V","Saekeke Football Shoes Boys FG/AG Low-top Soccer Shoes Girls Outdoor Athletics Training Football Boots for Kids Unisex Blue 4 US","Saekeke","FBA","Clothing, Shoes & Jewelry",244015,"Boys'",33.99,"N/A",169,4,5744.31,3248,4.4,"Saekeke",1,2391,"N/A","Large Standard-Size",9.5669291338583,12.55905511811,3.6220472440945,0.94815,173.77567604544444,604.4371340711111,"08/01/2021",19,7,229,0.05
"https://amazon.com/dp/B087J9P195","B087J9P195","Celmia Women's Overalls Shorts Sleeveless Casual Jumpsuit Rompers with Pockets A-Wine Red M","Celmia","FBA","Clothing, Shoes & Jewelry",788264,"Overalls",31.99,"N/A",2,-106,63.98,647,3.6,"Drseewd",1,651,-80,"Large Standard-Size",8.35,11.15,2.65,0.460845,98.51731553819442,342.66892361111104,"06/01/2021",32,7,145,0
"https://amazon.com/dp/B09S5T6X9L","B09S5T6X9L","Mens Tuxedo Suit Regular Fit 3 Piece Formal Sequin Tuxedo Suit Set One Button Single Breasted Suit for Wedding Party Prom","KUDORO","FBA","Clothing, Shoes & Jewelry",67791,"Suits",84.99,"N/A",379,205,32211.21,266,4.3,"KUDORO",1,3498,"N/A","Large Standard-Size",13.54,15.27,2.68,2.95029,221.2574220833333,769.5910333333333,"10/01/2022",8,7,151,1.42
"https://amazon.com/dp/B095S4LTHC","B095S4LTHC","Kaisrlse Sumter South Carolina USA Vintage Map Poster Sumter South Carolina USA Map Art Sumter South Carolina USA City Road Map Poster Vintage Gift Map 11X14 inch","Kaisrlse","FBM","Home & Kitchen",4095194,"Posters & Prints",19.49,"N/A",0,0,0,1,5,"Disouvenir",1,3,"N/A","N/A","N/A","N/A","N/A","N/A","N/A","N/A","04/01/2022",639,3,280,0
"https://amazon.com/dp/B09PHTNM8L","B09PHTNM8L","Celeste Stein Womens Mild Compression Knee High Stockings Queen Wide Calf - Queen - Multi Angles","Celeste Stein Designs","FBM","Clothing, Shoes & Jewelry",2698254,"Compression Socks",21.99,"N/A",1,-133,21.99,1,3,"Universal Screen Arts Inc",1,"N/A","N/A","Large Standard-Size",2,1,4,0.1,"N/A","N/A","12/01/2022",639,1,0,1
"https://amazon.com/dp/B0B3S5ZB1M","B0B3S5ZB1M","Lands' End K DJ LS Mock Neck Rashguard Deep Sea Navy/Gingham Mix Kids Medium","Lands' End","FBM","Clothing, Shoes & Jewelry",10602596,"Rash Guard Shirts",32.13,"N/A",0,0,0,"N/A","N/A","Lands' End",0,"N/A","N/A","Small Standard-Size",8.5,0.5,9,0.29,"N/A","N/A","08/01/2022",639,5,5,"N/A"
"https://amazon.com/dp/B08XXP5N96","B08XXP5N96","Cabilock 10PCS Yellow Beehive Wax Foundation Sheet Beehive Wax Frames Base Sheets Bee Comb Honey Frame Tool for Honey Extractor","Cabilock","FBM","Patio, Lawn & Garden",1390949,"Beekeeping Supplies",13.09,"N/A",0,0,0,"N/A","N/A","sinuoxiang",1,"N/A","N/A","Large Standard-Size",3.9370078740157,0.78740157480315,5.511811023622,0.033039647577093,"N/A","N/A","-",639,9,2,"N/A"
"https://amazon.com/dp/B08Z8LMG7T","B08Z8LMG7T","Certified 18K White Gold Heart Aquamarine 0.96 Carats Genuine Gemstone And Natural Diamonds 0.17 Carats(Hi Color Vs2Si1 Clarity) Engagement Wedding Ring For Women","Shweta Creations","FBM","Clothing, Shoes & Jewelry",13361421,"Statement",510.89,"N/A",0,0,0,"N/A","N/A","JEYPORE CREATIONSS",1,"N/A","N/A","Large Standard-Size",2.755905511811,1.5748031496063,2.755905511811,0.15418502202643,"N/A","N/A","-",7,7,21,"N/A"
"https://amazon.com/dp/B08GYSVBPP","B08GYSVBPP","April 1990 Limited Edition Gift Born In April 1990 T-Shirt","1990 Classic Birthday","Amazon","Clothing, Shoes & Jewelry",13361636,"Men",19.99,"N/A",0,0,0,"N/A","N/A","Amazon",1,"N/A","N/A","Large Standard-Size",8,1,10,0.3,"N/A","N/A","-",22,2,0,"N/A"
"https://amazon.com/dp/B09V8CKCJB","B09V8CKCJB","Lakers Kobe Logo Ladies V-Neck T-Shirt Purple Small","Shedd Shirts","FBM","Clothing, Shoes & Jewelry",146303,"Active Shirts & Tees",20.49,-51,63,637,1290.87,53,4.2,"Deals Tap",1,"N/A","N/A","N/A","N/A","N/A","N/A","N/A","N/A","N/A","02/01/2023",12,1,13,1.19
"https://amazon.com/dp/B0B4F27F28","B0B4F27F28","Carhartt Men's Loose Fit Midweight Sleeve Graphic Sweatshirt, Mossy Oak Bottomland Camo, Medium","Carhartt","FBA","Clothing, Shoes & Jewelry",459251,"Fashion Hoodies & Sweatshirts",64.3,-47,71,-64,4565.3,89,4.9,"JOYFUL HOME",0,"N/A","N/A","Large Standard-Size",11.417322834646,13.149606299213,3.3070866141732,1.38915,198.25673673658062,689.5886495185413,"11/01/2022",9,2,11,0.8